unclear	  criminal_triples/case_17.txt	  Court	 is	 unclear	  L. Rev. 121, 127 (1989) (Ake "left unanswered many questions," including "whether the defendant is entitled to 'neutral' or 'partisan' assistance"); Dubia, The Defense Right to Psychiatric Assistance in Light of Ake v. Oklahoma, 1987 Army Lawyer 15, 19-20 (Ake "did not define clearly the role of the state-supplied psychiatrist," and "[a] strong case can be made that Ake requires only access to an independent psychiatric examination"); Note, Due Process and Psychiatric Assistance: Ake v. Oklahoma, 21 Tulsa L. J. 121, 143 (1985) ("The Court is unclear as to the exact nature and scope of the substantive right it has created"); Sallet, Book Review, After Hinckley: The Insanity Defense Reexamined, 94 Yale L. J. 1545, 1551, n. 18 (1985) (predicting that "whether the Constitution requires one psychiatrist or rather one defense-oriented psy-chiatrist" would "likely be the next constitutional issue adjudicated")
arduous	  criminal_triples/case_17.txt	  majority	 completed	 arduous detour around question	  Having completed an arduous detour around the question that we agreed to decide, the majority encounters an inconvenient roadblock: The Court of Appeals has already determined that any error of the sort the majority identifies today was harmless
prevents	  criminal_triples/case_17.txt	  nothing	 prevents	 Court	  That conclusion is unwarranted, and nothing in the majority opinion prevents the Court of Appeals from reaching the same result on remand
unlike	  criminal_triples/case_17.txt	  harmless-error issue	 Moreover was briefed unlike	 question	  Moreover, unlike the question that the majority does decide, the harmless-error issue was at least briefed in a meaningful way by the parties
robbed	  criminal_triples/case_17.txt	  McWilliams	 robbed	 store	  McWilliams robbed the store, brutally raped Reynolds in a back room, then left her on the floor to die after shooting her six times execution style with a .38 caliber pistol
violent	  criminal_triples/case_17.txt	  McWilliams	 had	 violent felony convictions for robbery	  McWilliams had prior violent felony convictions for first-degree robbery and first-degree rape
suffered	  criminal_triples/case_17.txt	  McWilliams	 suffered from	 disorder	  McWilliams called an expert, Dr. Woods, who offered the opinion that McWilliams suffered from bipolar disorder at the time of the crime and testified that McWilliams's exaggeration of symptoms was not inconsistent with psychiatric problems
questionable	  criminal_triples/case_17.txt	  reliability	 are	 questionable	  It expressly found that "both the credibility of Dr. Woods and the reliability of his findings are questionable.
void	  criminal_triples/case_17.txt	  void	 is in	 record	  McWilliams's failure to call him as a witness there creates a "void in the record" that prevents McWilliams from carrying his burden of showing "how additional time with Dr. Goff (and his report) would have benefited the defense.
cruel	  criminal_triples/case_18.txt	  his death sentence	 therefore violated	 Eighth Amendment 's proscription of cruel punishments	  A state habeas court subsequently determined that, under Atkins v. Virginia, 536 U. S. 304, and Hall v. Florida, 572 U. S. ___, Moore qualified as intellectually disabled and that his death sentence therefore violated the Eighth Amendment's proscription of "cruel and unusual punishments.
undercut	  criminal_triples/case_18.txt	  his strengths	 undercut	 adaptive weaknesses	  And even if he had, the CCA continued, his adaptive strengths undercut any adaptive weaknesses
weaknesses	  criminal_triples/case_18.txt	  his strengths	 undercut	 adaptive weaknesses	  And even if he had, the CCA continued, his adaptive strengths undercut any adaptive weaknesses
unacceptable	  criminal_triples/case_18.txt	  perceptions	 creat	 unacceptable risk	  By design and in operation, the lay perceptions advanced by Briseno "creat[e] an unacceptable risk that persons with intellectual disability will be executed.
stereotypes	  criminal_triples/case_18.txt	  medical profession	 counter	 stereotypes	  The medical profession has endeavored to counter lay stereotypes, and the Briseno factors are an outlier, in comparison both to other States' handling of intellectual-disability pleas and to Texas' own practices in contexts other than the death penalty
botched	  criminal_triples/case_18.txt	  Bobby James Moore	 shot store clerk during	 botched robbery	  Bobby James Moore fatally shot a store clerk during a botched robbery
upsetting	  criminal_triples/case_18.txt	  factors	 upsetting	 Moore 's death sentence	  The appeals court further determined that the evidentiary factors announced in Briseno "weigh[ed] heavily" against upsetting Moore's death sentence
difficulties	  criminal_triples/case_18.txt	  Moore	 had	 difficulties beginning at age	  The evidence revealed that Moore had significant mental and social difficulties beginning at an early age
slow	  criminal_triples/case_18.txt	  teachers	 called for	 his slow reading	  Moore's father, teachers, and peers called him "stupid" for his slow reading and speech
trash	  criminal_triples/case_18.txt	  he	 survived	 eating from trash cans after two bouts	  Cast out of his home, he survived on the streets, eating from trash cans, even after two bouts of food poisoning
criticism	  criminal_triples/case_18.txt	  Judge Alcala	 recounting	 criticism of factors	  Judge Alcala questioned the legitimacy of the seven Briseno factors, recounting wide criticism of the factors and explaining how they deviate from the current medical consensus
irreconcilable	  criminal_triples/case_18.txt	  CCA 's conclusion	 is irreconcilable with	 Hall	  The CCA's conclusion that Moore's IQ scores established that he is not intellectually disabled is irreconcilable with Hall
poor	  criminal_triples/case_18.txt	  poor effort	 experiencing	 depression	  The CCA found, however, that Moore's score was unlikely to be in the lower end of the error-generated range because he was likely exerting poor effort and experiencing depression at the time the test was administered--both factors that Moore's experts agreed could artificially deflate IQ scores
conflicting	  criminal_triples/case_18.txt	  factfinders	 confronting	 conflicting evidence	  As factfinders often do in confronting conflicting evidence, the CCA made a credibility determination
repugnant	  criminal_triples/case_18.txt	  our society	 deems	 repugnant	  The Eighth Amendment, under our precedent, is supposed to impose a moral backstop on punishment, prohibiting sentences that our society deems repugnant
flat	  criminal_triples/case_18.txt	  AAIDD	 enact	 flat ban looking	  But the stringency of their caution differs, with the AAIDD seeming to enact a flat ban on ever looking to functioning in prison and the DSM urging "if possible" to consider "corroborative information reflecting functioning outside" of prison
lie	  criminal_triples/case_18.txt	  person	 lie effectively in	 his own	  &TLRbull2;     "Can the person hide facts or lie effectively in his own or others' interests
unsurprising	  criminal_triples/case_18.txt	  it	 is	 unsurprising	  Given the Briseno factors' flaws, it is unsurprising that scholars and experts have long criticized the factors
flaws	  criminal_triples/case_18.txt	  it	 is unsurprising Given	 Briseno factors ' flaws	  Given the Briseno factors' flaws, it is unsurprising that scholars and experts have long criticized the factors
assault	  criminal_triples/case_19.txt	  Petitioner Louis Alonzo Madden	 attempted	 sexual assault	  Petitioner Louis Alonzo Madden was convicted by a Colorado jury of attempting to patronize a prostituted child and attempted sexual assault
loss	  criminal_triples/case_19.txt	  Exoneration Act	 compensate	 defendant for loss of her liberty	  Colorado argued on brief that if the Exoneration Act provides sufficient process to compensate a defendant for the loss of her liberty, the Act should also suffice "when a defendant seeks compensation for the less significant deprivation of monetary assessments paid pursuant to a conviction that is later overturned.
invite	  criminal_triples/case_19.txt	  petitioners	 Indeed invite	 Brief	  Indeed, petitioners invite us to measure the Colorado scheme against traditional practice, reminding us that our " 'first due process cases' " recognized that " 'traditional practice provides a touchstone for constitutional analysis,' " Brief for Petitioners 26 (quoting Honda Motor Co. v. Oberg, 512 U. S. 415, 430 (1994))
argue	  criminal_triples/case_19.txt	  Petitioners	 go on	 argue at length	  Petitioners then go on to argue at some length that "[t]he traditional rule has always been that when a judgment is reversed, a person who paid money pursuant to that judgment is entitled to receive the money back.
remains	  criminal_triples/case_19.txt	  money	 remains	 their property under state law	  Petitioners contend that the money remains their property under state law
misses	  criminal_triples/case_19.txt	  Court 's due process analysis	 misses point	 it arises under substantive process	  If it arises under substantive due process, then the Court's procedural due process analysis misses the point
sights	  criminal_triples/case_19.txt	  dissent	 from	 sights	  Shut from the dissent's sights, however, the convictions pursuant to which the State took petitioners' money were invalid, hence the State had no legal right to retain their money
unrelated	  criminal_triples/case_20.txt	  law	 preventing	 range of communication unrelated	  Rather, the law "arbitrarily burdens all registered sex offenders by preventing a wide range of communication and expressive activity unrelated to achieving its purported goal.
alarming	  criminal_triples/case_20.txt	  law	 creates	 criminal prohibition of alarming breadth	  They stated that the law impermissibly "creates a criminal prohibition of alarming breadth and extends well beyond the evils the State seeks to combat.
difficulty	  criminal_triples/case_20.txt	  there may have difficulty	 is in	 past	  While in the past there may have been difficulty in identifying the most important places (in a spatial sense) for the exchange of views, today the answer is clear
politics	  criminal_triples/case_20.txt	  users	 can debate	 politics	  On Facebook, for example, users can debate religion and politics with their friends and neighbors or share vacation photos
unaware	  criminal_triples/case_20.txt	  its participants	 be	 in its early stages unaware of it	  The nature of a revolution in thought can be that, in its early stages, even its participants may be unaware of it
unable	  criminal_triples/case_20.txt	  they	 may	 still may unable	  And when awareness comes, they still may be unable to know or foresee where its changes lead
scrutiny	  criminal_triples/case_20.txt	  law	 survive	 scrutiny	  In order to survive intermediate scrutiny, a law must be "narrowly tailored to serve a significant governmental interest.
stroke	  criminal_triples/case_20.txt	  North Carolina	 is with	 one broad stroke bars	  By prohibiting sex offenders from using those websites, North Carolina with one broad stroke bars access to what for many are the principal sources for knowing current events, checking ads for employment, speaking and listening in the modern public square, and otherwise exploring the vast realms of human thought and knowledge
troubled	  criminal_triples/case_20.txt	  I	 am	 troubled	  I am troubled by the implications of the Court's unnecessary rhetoric
demanding	  criminal_triples/case_20.txt	  he	 more demanding standard of	 review	  Packingham responds that the challenged statute is "unlike any law this Court has considered as a time, place, or manner restriction," Brief for Petitioner 37, and he advocates a more demanding standard of review, id., at 37-39
exploitation	  criminal_triples/case_20.txt	  he	 prevention of	 sexual exploitation	  As we have frequently noted, "[t]he prevention of sexual exploitation and abuse of children constitutes a government objective of surpassing importance.
grave	  criminal_triples/case_20.txt	  Repeat sex offenders	 pose	 grave risk to children	  Repeat sex offenders pose an especially grave risk to children
loose	  criminal_triples/case_20.txt	  I	 am troubled by	 Court 's loose rhetoric	  While I thus agree with the Court that the particular law at issue in this case violates the First Amendment, I am troubled by the Court's loose rhetoric
